{
  "analysis": {
    "description": "Field coverage and H1 usability of the converted runs in h1-sample.jsonl. Gate G2.",
    "hypothesis": "none",
    "name": "px4-h1-inventory"
  },
  "code": {
    "dirty": false,
    "entrypoint": "ingest/inventory.py",
    "git_commit": "659df4c863349184444ed3de6fdfbe8ab98135a9"
  },
  "created_at": "2026-08-26T22:55:16.765257+00:00",
  "environment": {
    "dependencies": {
      "cdsapi": "0.7.7",
      "duckdb": "1.5.5",
      "gcsfs": "2026.8.0",
      "httpx": "0.28.1",
      "jsonschema": "4.26.0",
      "matplotlib": "3.11.1",
      "netcdf4": "1.7.4",
      "numpy": "2.5.2",
      "pandas": "3.0.5",
      "pyarrow": "25.0.1",
      "pyyaml": "6.0.3",
      "scipy": "1.18.0",
      "xarray": "2026.7.0",
      "zarr": "3.3.0"
    },
    "platform": "Windows-11-10.0.26200-SP0",
    "python_version": "3.13.14"
  },
  "external_tools": [
    {
      "name": "ulog-convert",
      "version": "ulog-convert 0.1.0 (flight-review-rs@0fb44f74)"
    }
  ],
  "inputs": [],
  "manifest_id": "a24a2cf3-a96c-4c35-a200-0c159c22620f",
  "outputs": [
    {
      "content_hash": "sha256:03c0616764a8ea6506bf592e21d5be575dbe78d51e02c6206174b86f7d58f4af",
      "path": "artifacts/h1-inventory.json"
    }
  ],
  "parameters": {
    "position_columns": [
      "lat",
      "lon"
    ],
    "required_topics": [
      "wind",
      "vehicle_global_position"
    ],
    "sample": "data\\h1-sample.jsonl",
    "wind_components": [
      "windspeed_north",
      "windspeed_east"
    ]
  },
  "seed": null
}
