{
  "analysis": {
    "description": "The same run windows read through the CDS and through ARCO-ERA5, compared value by value and marker by marker. Evidence for adr/0013 and the re-check for the ERA5T windows.",
    "hypothesis": "H1",
    "name": "era5-route-comparison"
  },
  "code": {
    "dirty": true,
    "entrypoint": "analysis/h1_agreement/compare_era5_routes.py",
    "git_commit": "78c53adb3ecdcce0f0d94b289f14f535598dc3cb"
  },
  "created_at": "2026-08-26T07:43:21.106403+00:00",
  "environment": {
    "dependencies": {
      "cdsapi": "0.7.7",
      "duckdb": "1.5.5",
      "httpx": "0.28.1",
      "jsonschema": "4.26.0",
      "matplotlib": "3.11.1",
      "netcdf4": "1.7.4",
      "numpy": "2.5.2",
      "pandas": "3.0.5",
      "pyarrow": "25.0.1",
      "pyyaml": "6.0.3",
      "scipy": "1.18.0",
      "xarray": "2026.7.0"
    },
    "platform": "Windows-11-10.0.26200-SP0",
    "python_version": "3.13.14"
  },
  "external_tools": [],
  "inputs": [
    {
      "content_hash": "sha256:b92abf8980fb2947fd7c4a58181b8cb27bd23c82aab84a645c0a42840eb81673",
      "path": "data/pilot-pairs.jsonl"
    }
  ],
  "manifest_id": "a78b5f1d-af4c-4ba7-865d-755763d7e283",
  "outputs": [
    {
      "content_hash": "sha256:b9d7a04667ae78345b55ec02cb29dad1f89384d86853a14b85334bab1d4dc444",
      "path": "artifacts/era5-route-comparison.json"
    }
  ],
  "parameters": {
    "arco_coverage": {
      "last_updated": "2026-08-26 03:15:47.457969+00:00",
      "store": "gs://gcp-public-data-arco-era5/ar/full_37-1h-0p25deg-chunk-1.zarr-v3",
      "valid_time_start": "1940-01-01",
      "valid_time_stop": "2026-04-30",
      "valid_time_stop_era5t": "2026-08-20"
    },
    "compared_fields": [
      "era5_100m_u",
      "era5_100m_v",
      "era5_10m_u",
      "era5_10m_v"
    ]
  },
  "seed": null
}
