{
  "analysis": {
    "description": "Field coverage and H1 usability of the converted pilot sample. Gate G2.",
    "hypothesis": "none",
    "name": "px4-pilot-inventory"
  },
  "code": {
    "dirty": true,
    "entrypoint": "ingest/inventory.py",
    "git_commit": "37aab7af85fc83cac7241946ad225e537b084aac"
  },
  "created_at": "2026-08-25T18:29:52.309778+00:00",
  "environment": {
    "dependencies": {
      "cdsapi": "0.7.7",
      "duckdb": "1.5.5",
      "httpx": "0.28.1",
      "jsonschema": "4.26.0",
      "matplotlib": "3.11.1",
      "netcdf4": "1.7.4",
      "numpy": "2.5.2",
      "pandas": "3.0.5",
      "pyarrow": "25.0.1",
      "pyyaml": "6.0.3",
      "scipy": "1.18.0",
      "xarray": "2026.7.0"
    },
    "platform": "Windows-11-10.0.26200-SP0",
    "python_version": "3.13.14"
  },
  "external_tools": [
    {
      "name": "ulog-convert",
      "version": "ulog-convert 0.1.0 (flight-review-rs@0fb44f74)"
    }
  ],
  "inputs": [],
  "manifest_id": "aa867909-4c9a-43d4-8a87-e2d7e93c7c18",
  "outputs": [
    {
      "content_hash": "sha256:7913603bdd536e297563828fe7e612e0e8b655afa66e80d0b62d29505836805a",
      "path": "artifacts/pilot-inventory.json"
    }
  ],
  "parameters": {
    "position_columns": [
      "lat",
      "lon"
    ],
    "required_topics": [
      "wind",
      "vehicle_global_position"
    ],
    "wind_components": [
      "windspeed_north",
      "windspeed_east"
    ]
  },
  "seed": null
}
