{
  "analysis": {
    "description": "Chunked retrieval of the H1 draw from PX4 Flight Review, with per-chunk conversion, pruning of the raw logs, and availability observed before each prune.",
    "hypothesis": "H1",
    "name": "px4-h1-retrieval"
  },
  "code": {
    "dirty": true,
    "entrypoint": "ingest/retrieve_h1.py",
    "git_commit": "78c53adb3ecdcce0f0d94b289f14f535598dc3cb"
  },
  "created_at": "2026-08-26T07:13:28.976137+00:00",
  "environment": {
    "dependencies": {
      "cdsapi": "0.7.7",
      "duckdb": "1.5.5",
      "httpx": "0.28.1",
      "jsonschema": "4.26.0",
      "matplotlib": "3.11.1",
      "netcdf4": "1.7.4",
      "numpy": "2.5.2",
      "pandas": "3.0.5",
      "pyarrow": "25.0.1",
      "pyyaml": "6.0.3",
      "scipy": "1.18.0",
      "xarray": "2026.7.0"
    },
    "platform": "Windows-11-10.0.26200-SP0",
    "python_version": "3.13.14"
  },
  "external_tools": [],
  "inputs": [
    {
      "content_hash": "sha256:9e4a76c6ad2524300318ac312cd0224728e97467904de89cf0789549a2ceaca5",
      "path": "C:/dev/occas/data/dbinfo.json.gz"
    },
    {
      "content_hash": "sha256:65abcddb618d7b022e7976a352dea241e6799f75b97a1dc8a072673aecf82336",
      "path": "C:/dev/occas/artifacts/h1-sample-summary.json"
    }
  ],
  "manifest_id": "af9fcb5d-caa2-4572-b09e-33e56b044460",
  "outputs": [
    {
      "content_hash": "sha256:4cc798dbb05c3c7ad34b4ea4889a00e8552be0a5931381c911c25def5df0a02e",
      "path": "C:/dev/occas/artifacts/h1-availability.json"
    }
  ],
  "parameters": {
    "already_held": 52,
    "chunk_size": 100,
    "delay_seconds": 6,
    "drawn": 1600,
    "exclusions": {
      "count": 0,
      "digest": "sha256:e3b0c44298fc1c149afbf4c8996fb92427ae41e4649b934ca495991b7852b855",
      "latest_received": null,
      "path": "data/exclusions.jsonl"
    },
    "frame_entries": 450395,
    "frame_served_locally": true,
    "min_plausible_bytes": 4096,
    "prune_raw": true,
    "requested": 1548,
    "ulog_magic_checked": true
  },
  "seed": null
}
