{
  "analysis": {
    "description": "Stratified pilot sample of the >=300 s non-SITL frame, for gate G2. Draws ids only; no logs retrieved.",
    "hypothesis": "none",
    "name": "px4-pilot-sample"
  },
  "code": {
    "dirty": true,
    "entrypoint": "ingest/sample.py",
    "git_commit": "fe6805294d58efeaa121329c12d3f50796507ba5"
  },
  "created_at": "2026-08-25T19:16:23.226735+00:00",
  "environment": {
    "dependencies": {
      "cdsapi": "0.7.7",
      "duckdb": "1.5.5",
      "httpx": "0.28.1",
      "jsonschema": "4.26.0",
      "matplotlib": "3.11.1",
      "netcdf4": "1.7.4",
      "numpy": "2.5.2",
      "pandas": "3.0.5",
      "pyarrow": "25.0.1",
      "pyyaml": "6.0.3",
      "scipy": "1.18.0",
      "xarray": "2026.7.0"
    },
    "platform": "Windows-11-10.0.26200-SP0",
    "python_version": "3.13.14"
  },
  "external_tools": [],
  "inputs": [
    {
      "content_hash": "sha256:9e4a76c6ad2524300318ac312cd0224728e97467904de89cf0789549a2ceaca5",
      "path": "data/dbinfo.json.gz",
      "source": {
        "attribution": "Flight logs from PX4 Flight Review (logs.px4.io), CC-BY PX4.",
        "licence": "CC-BY-4.0",
        "retrieved_at": "2026-08-20T21:08:00+00:00",
        "source": "px4_flight_review",
        "source_url": "https://cdn.logs.px4.io/dbinfo.json",
        "source_version": "gzip header mtime 2026-08-20T00:00:52Z"
      }
    }
  ],
  "manifest_id": "d245f91a-4534-4901-a29e-6d692a53eb00",
  "outputs": [
    {
      "content_hash": "sha256:65abcddb618d7b022e7976a352dea241e6799f75b97a1dc8a072673aecf82336",
      "path": "artifacts/h1-sample-summary.json"
    }
  ],
  "parameters": {
    "classes": [
      "fixed_wing_or_vtol"
    ],
    "exclusions": {
      "count": 0,
      "digest": "sha256:e3b0c44298fc1c149afbf4c8996fb92427ae41e4649b934ca495991b7852b855",
      "latest_received": null,
      "path": "data/exclusions.jsonl"
    },
    "max_per_vehicle": 1,
    "min_duration_s": 300,
    "per_cell": 800,
    "retention_window_days": 365
  },
  "seed": 20260825
}
