{
  "analysis": {
    "description": "Agreement between ERA5 and the onboard EKF2 wind estimate, per regime and per vertical reference. Neither source is ground truth.",
    "hypothesis": "H1",
    "name": "h1-agreement"
  },
  "code": {
    "dirty": false,
    "entrypoint": "analysis/h1_agreement/agreement.py",
    "git_commit": "6d1e70e712c8c98e31bbf77d2b12781fae76344b"
  },
  "created_at": "2026-08-27T10:07:41.498867+00:00",
  "environment": {
    "dependencies": {
      "cdsapi": "0.7.7",
      "duckdb": "1.5.5",
      "gcsfs": "2026.8.0",
      "httpx": "0.28.1",
      "jsonschema": "4.26.0",
      "matplotlib": "3.11.1",
      "netcdf4": "1.7.4",
      "numpy": "2.5.2",
      "pandas": "3.0.5",
      "pyarrow": "25.0.1",
      "pyyaml": "6.0.3",
      "scipy": "1.18.0",
      "xarray": "2026.7.0",
      "zarr": "3.3.0"
    },
    "platform": "Windows-11-10.0.26200-SP0",
    "python_version": "3.13.14"
  },
  "external_tools": [],
  "inputs": [],
  "manifest_id": "d416fcf4-1ba3-48e2-b3f3-eb75a1168daf",
  "outputs": [
    {
      "content_hash": "sha256:6658db455370e7ea6d593fcc0df0c5a5c76f87b607a511eaefc3f7d2ec348c50",
      "path": "artifacts/h1-agreement.json"
    },
    {
      "content_hash": "sha256:7e03ebc1493fff8a2f7418d057afeba1674657edbb93d2c609bffd4747012550",
      "path": "artifacts/h1-validation-artifacts.jsonl"
    }
  ],
  "parameters": {
    "bootstrap_resamples": 2000,
    "difference_direction": "era5_minus_onboard",
    "direction_speed_threshold_ms": 2.0,
    "direction_sweep_ms": [
      1.0,
      3.0
    ],
    "exclusions": {
      "count": 0,
      "digest": "sha256:e3b0c44298fc1c149afbf4c8996fb92427ae41e4649b934ca495991b7852b855",
      "latest_received": null,
      "path": "data/exclusions.jsonl"
    },
    "frame_sizes": {
      "fixed_wing_or_vtol|older": 10497,
      "fixed_wing_or_vtol|within_window": 6185
    },
    "loa_z": 1.96,
    "min_runs_per_regime": 20,
    "min_vehicles_per_regime": 10,
    "processing_version": "agreement/1",
    "regime_axes": [
      "airframe",
      "airspeed_topic",
      "estimator_sigma",
      "season"
    ],
    "regime_axes_declared_but_not_cut": [
      "firmware_version",
      "altitude_agl",
      "topography"
    ],
    "sensitivity_distance_km": [
      10.0,
      15.0,
      20.0,
      30.0
    ],
    "sigma_bands_ms": [
      0.5,
      1.0
    ],
    "useful_proxy_loa_ms": 3.0
  },
  "seed": 20260827
}
