{
  "analysis": {
    "description": "ERA5 fields paired to onboard wind per run window, for the pilot. Builds the input to H1; computes no agreement statistic.",
    "hypothesis": "H1",
    "name": "h1-pilot-pairs"
  },
  "code": {
    "dirty": true,
    "entrypoint": "analysis/h1_agreement/build_pairs.py",
    "git_commit": "31d285b45a5dbd750810299d1b189c546169a311"
  },
  "created_at": "2026-08-25T18:37:16.484039+00:00",
  "environment": {
    "dependencies": {
      "cdsapi": "0.7.7",
      "duckdb": "1.5.5",
      "httpx": "0.28.1",
      "jsonschema": "4.26.0",
      "matplotlib": "3.11.1",
      "netcdf4": "1.7.4",
      "numpy": "2.5.2",
      "pandas": "3.0.5",
      "pyarrow": "25.0.1",
      "pyyaml": "6.0.3",
      "scipy": "1.18.0",
      "xarray": "2026.7.0"
    },
    "platform": "Windows-11-10.0.26200-SP0",
    "python_version": "3.13.14"
  },
  "external_tools": [],
  "inputs": [],
  "manifest_id": "96d6d1cd-61e8-4173-9853-eb51df7eafe7",
  "outputs": [
    {
      "content_hash": "sha256:aaebdfccbacab93fad19b95ea15a79661aed7f25c725a3caaeb6ca7156b1ce99",
      "path": "artifacts/pilot-join-summary.json"
    }
  ],
  "parameters": {
    "era5_variables": [
      "100m_u_component_of_wind",
      "100m_v_component_of_wind",
      "10m_u_component_of_wind",
      "10m_v_component_of_wind"
    ],
    "grid_deg": 0.25,
    "min_samples_per_window": 5,
    "processing_version": "build_pairs/1",
    "spatial_tolerance_km": 30.0,
    "temporal_tolerance_s": 1800.0
  },
  "seed": null
}
